{
  "brief_hash": "e5cc4a48",
  "iteration": "001",
  "rubric_name": "unit:v0",
  "rubric_scores": {
    "scores": {
      "coverage": 4.7,
      "unambiguity": 4.8,
      "mock_discipline": 4.8,
      "executability": 4.3
    },
    "weights": {
      "coverage": 0.3,
      "unambiguity": 0.25,
      "mock_discipline": 0.25,
      "executability": 0.2
    },
    "weighted_total": 4.67
  },
  "axis_rationales": {
    "coverage": "열거 32개, 덮음 30개, 누락: [7일 이하 무료 전액 환불을 산출과 주문 적용까지 한 흐름에서 검증하는 케이스, UTC 시분초 제거가 서로 다른 시각이지만 같은/다음 UTC 날짜로 접히는 추가 사례]. 덮음: MANUAL 우선순위, 무료 0/7/8일, PRORATION 전액/부분/마지막날/0원/절사/totalDays<=0, MANUAL 정상/초과/0/-1, cancellableAmount 기반 FULL/PARTIAL, PAID/PARTIALLY_REFUNDED 허용, REFUNDED/PENDING/FAILED 거절, 초과 거절, 주문 상태 4전이, Refund REQUESTED 및 SUCCEEDED/FAILED/TIMED_OUT, PG Mock 성공/거부/불확실 흐름을 포함한다.",
    "unambiguity": "대부분의 단언이 금액·상태·유형·예외 클래스를 구체값으로 비교하며, 느슨한 null/boolean 대체 검증은 거의 없다.",
    "mock_discipline": "PG 외부 의존만 Mockito로 대체하고 계산·주문·환불 상태 전이는 실제 객체의 상태로 검증하지만, 서비스 테스트에서 verifyNoMoreInteractions까지 포함해 약간 엄격한 행위 검증이 있다.",
    "executability": "JUnit5, Mockito, AssertJ 구조와 입력·기대값은 명확하나 RefundCommand/RefundCalculator/RefundApplicationService 등 테스트가 제안한 API 표면이 다소 넓어 기존 구현과 즉시 맞물린다는 보장은 제한적이다."
  },
  "calibration_note": "5점은 드물게 적용한다는 기준에 따라, 누락 케이스가 거의 없고 단언·Mock 경계가 명확하지만 API 표면을 테스트가 일부 발명한 점을 반영해 executability는 감점했다.",
  "evaluated_at": "2026-07-06T11:27:04+09:00",
  "model": "gpt-5.5",
  "metadata": {
    "prompt_version": "eval_system:v1",
    "source_files": [
      "e5cc4a48_input.json",
      "e5cc4a48_iter-001_draft.json"
    ],
    "token_usage": {
      "input_tokens": 33043,
      "cached_input_tokens": 2432,
      "output_tokens": 1046,
      "reasoning_output_tokens": 516
    }
  }
}
