{
  "brief_hash": "6ec3182a",
  "iteration": "001",
  "rubric_name": "contract:v1-spec",
  "rubric_scores": {
    "scores": {
      "coverage": 1,
      "boundary_fidelity": 5,
      "unambiguity": 2,
      "behavioral_altitude": 5,
      "interaction_hazard_coverage": 5
    },
    "weights": {
      "coverage": 0.25,
      "boundary_fidelity": 0.25,
      "unambiguity": 0.15,
      "behavioral_altitude": 0.15,
      "interaction_hazard_coverage": 0.2
    },
    "weighted_total": 3.55
  },
  "axis_rationales": {
    "coverage": "열거 31개, 누락 10개: [빈자리 알림 신청의 인증 실패, 예약 상태 조회의 지원하지 않는 코트, 저장 결과가 있는 상태에서 외부 예약처 불가용 실패, 저장 결과가 있는 상태에서 외부 응답 해독 실패, 저장 결과가 없는 상태에서 외부 시간초과 실패, 저장 결과가 없는 상태에서 외부 불가용 실패, 예약 상태 조회의 저장소 실패, 신청의 저장소 실패, 신청의 내부 실패, 같은 멱등 표식의 선행 요청 처리 중 충돌]. 신청 정상·멱등 재시도·조건 충돌·보관 만료·활성/종료 중복·신청 동시성 및 예약 조회의 성공·미개방 날짜·일부 실패·동시성은 매핑된다.",
    "boundary_fidelity": "모든 When은 빈자리 알림 신청 또는 코트·날짜 예약 상태 조회라는 inbound port 하나에 대응한다. Then은 신청 상태·중복 제거·반환 결과·예약 상태·실패 여부 같은 관찰 가능한 도메인 결과를 단언하며 호출 순서·횟수·verify·내부 저장 구조를 단언하지 않는다.",
    "unambiguity": "구체적인 시간대와 상태를 제시한 시나리오가 많지만, '신청이 거절된다', '예약 상태가 반환된다', '알 수 있다', '실패 결과가 반환된다'처럼 실패 원인이나 반환 내용이 봉인되지 않은 단언이 여러 곳에 남아 있어 잘못된 구현을 놓칠 수 있다.",
    "behavioral_altitude": "시나리오는 신청, 감시, 만료, 예약 상태, 외부 예약처, 재시도 표식 같은 도메인 언어로 작성되었고 HTTP 상태 코드·헤더명·에러 코드·필드명·타입·클래스나 메서드명·내부 저장 구조를 노출하지 않는다. 내부 산식도 제시하지 않는다.",
    "interaction_hazard_coverage": "열거 4개, 누락 0개: [같은 조건의 재신청에 대한 중복 제거, 같은 재시도 표식의 재요청 결과 재생, 같은 조건의 동시 신청, 같은 표식의 동시 신청, 같은 코트·날짜의 동시 조회 성공, 같은 코트·날짜의 동시 조회 실패]. 각 시나리오가 하나의 신청 또는 모든 조회자가 받는 동일한 결과라는 net 상태를 관찰한다."
  },
  "calibration_note": "Critique나 생성 과정은 참조하지 않고 정책·원본 계약·rubric만 기준으로 독립 채점했다. 평균 3.0을 기준으로 두었으며, 다수의 경계 누락과 느슨한 단언을 엄격하게 반영했다.",
  "evaluated_at": "2026-09-22T15:44:45+09:00",
  "model": "gpt-5.5",
  "metadata": {
    "prompt_version": "eval_system:v1",
    "source_files": [
      "6ec3182a_input.json",
      "6ec3182a_iter-001_draft.json"
    ],
    "token_usage": {
      "input_tokens": 56688,
      "cached_input_tokens": 2432,
      "output_tokens": 3685,
      "reasoning_output_tokens": 2952
    }
  }
}
