{
  "brief_hash": "f1ba346d",
  "iteration": "002",
  "rubric_name": "contract:v1-spec",
  "rubric_scores": {
    "scores": {
      "coverage": 4.5,
      "boundary_fidelity": 4.5,
      "unambiguity": 4.0,
      "behavioral_altitude": 4.5
    },
    "weights": {
      "coverage": 0.3,
      "boundary_fidelity": 0.3,
      "unambiguity": 0.2,
      "behavioral_altitude": 0.2
    },
    "weighted_total": 4.4
  },
  "axis_rationales": {
    "coverage": "열거 11개(내부 산술 제외): (1)수동 지정 우선, (2)7일 이내 전액[0·7 안쪽], (3)8일 이후 일할[미사용→전액·전소진→0], (4)환불유형 전액/부분 경계, (5)주문상태 게이트[완료·부분환불 수락 ↔ 전액·대기·실패 거절], (6)환불금액 초과 경계[10000 수락 ↔ 10001 거절], (7)수동금액 0 이하 거절[1·0·-1], (8)구독기간 무효 거절[1·0], (9)거절 시 가능금액 불변, (10)주문 상태전이 4케이스, (11)결제취소 결과별 마무리. 누락 0개. 핵심 경계 대부분 안/밖 짝으로 삼각측량(7↔8, 30000↔29999, 10000↔10001, 수락↔거절). 다만 '수동금액>가능금액' 거절이 일반 초과규칙으로만 덮여 수동-특정 짝은 아쉬워 5 대신 4.5.",
    "boundary_fidelity": "모든 When이 inbound port 1:1('환불을 요청하면','결제 취소 결과가 도착하면')이며 내부 절차·협력자 나열 없음. 모든 Then이 경계 관찰 결과(환불 금액·유형, 수락/거절, 주문 상태, 환불 마무리 상태, 가능금액 유지)로 단언. 호출 순서·횟수·내부 상태·원시 기본값 단언 0. '환불 금액 0원'은 만료 환불의 도메인 결과이지 내부 원시값 단언이 아니라 캡 대상 아님. 결제취소 feature의 '이전 상태 그대로'도 관찰 가능한 도메인 상태. 극소수 표현만 아쉬워 5 대신 4.5.",
    "unambiguity": "구체 도메인 관찰 단언 위주(5000원·30000원·29999원, 전액/부분, 수락/거절, REFUNDED 여부)로 틀린 구현이면 실패한다. 봉인·'should work'류 단언 0. 다만 '결제 금액 전액'·'이전 상태 그대로'가 값 자체가 아닌 참조 표현이라 한두 곳 정밀도가 아쉬워 4.0(느슨 단언은 아니어서 3 캡에는 안 걸림).",
    "behavioral_altitude": "클래스·메서드·필드·enum 상수(PAID 등) 미노출 — 상태를 '결제 완료/부분 환불/전액 환불/결제 대기/결제 실패' 도메인어로 서술. UTC·NPE 등 기술용어 없음. 일할 단가·절사 산식을 feature 본문에서 명시적으로 배제('계산 과정은 규칙 문서에 둔다')해 고도 유지. '총 구독 일수'·'경과일 8일'이 계산 입력에 근접하나 도메인 경계 조건 수준이라 감점 최소. 5 대신 4.5."
  },
  "calibration_note": "게이트 통과 후보 수준의 고완성 초안. 4축 모두 캡 조건(When 1:1 위반·상호작용/순서/내부상태/원시기본값 단언·구현세부·산식 노출) 미해당이라 상한 제한 없음. coverage 누락 0·삼각측량 양호, altitude가 산식을 rules로 밀어내 특히 견고. 5점은 수동-특정 초과 짝·일부 참조 표현의 정밀도 여지로 보류하고 4.4로 보정.",
  "evaluated_at": "2026-07-21T20:32:21+09:00",
  "model": "claude-sonnet-4-6",
  "metadata": {
    "prompt_version": "eval_system:v1",
    "source_files": [
      "f1ba346d_input.json",
      "f1ba346d_iter-002_draft.json"
    ]
  }
}
