{
  "brief_hash": "d1309fc2",
  "iteration": "002",
  "rubric_name": "rules:v1",
  "rubric_scores": {
    "scores": {
      "coverage": 4.0,
      "value_correctness": 5.0,
      "unambiguity": 4.0,
      "altitude": 5.0,
      "invariant_generality": 4.0
    },
    "weights": {
      "coverage": 0.25,
      "value_correctness": 0.25,
      "unambiguity": 0.15,
      "altitude": 0.15,
      "invariant_generality": 0.2
    },
    "weighted_total": 4.45
  },
  "axis_rationales": {
    "coverage": "열거 12개, 누락 0개: [BB 산출, 몸통 중점/방향별 strict 이탈, 첫 전이, 밴드폭, 스퀴즈 <=25%, 진입, 손절, 리스크, 리스크 0 미발화, 목표, 발화 게이트 결합, 닫힌 캔들 기준/방향 배타성] 모두 표로 매핑됨. 다만 스퀴즈 백분위의 산출 알고리즘은 정책의 '백분위'를 count<=현재 방식으로 구체화했으나 원 정책이 그 알고리즘까지 명시하지 않아 구현 반례는 아니지만 5점까지는 제한함; 구현 반례: 없음.",
    "value_correctness": "재계산 47행, 불일치 0행: BB 예시의 평균/모집단 σ/상하단, 몸통 중점 strict 비교, 첫 전이 비교, 밴드폭, 스퀴즈 count/100, 진입·손절·리스크·목표, 결합 게이트, 닫힌 캔들 기준, 방향 배타성 기대값이 제시 산식과 일치함.",
    "unambiguity": "모든 표 입력·기대출력은 대체로 구체값이며 등호 경계와 strict 비교도 명시됨. 다만 '현재 이탈 참', '상방 조건 모두 참'처럼 일부 결합 표는 하위 산식 결과를 봉인한 셀로 표현되어 단독 재현성은 약간 떨어짐.",
    "altitude": "클래스명·메서드명·시그니처·자료구조·enum 상수 노출 없이 중심선, 밴드폭, 기준봉, 손절, 리스크 등 도메인 수량과 판정 어휘로만 서술됨.",
    "invariant_generality": "불변식 열거 7개, ∀진술 7개, witness검산 4개: [밴드 대칭/합, 스퀴즈 iff count<=25, 리스크 비음수, 리스크 0 미발화, 상방/하방 2R 목표거리, 발화 iff 5조건+리스크, 상하방 동시 발화 불가]가 전칭 문장으로 진술됨. BB·스퀴즈·목표는 tight witness 검산이 있으나 첫 전이와 닫힌 캔들 선택의 전칭 불변식 및 일부 교차 witness는 약함."
  },
  "calibration_note": "엄격 게이트 기준으로 평균 3.0을 기준점으로 보았고, 산식 값 오류는 없으나 스퀴즈 백분위 알고리즘 구체화와 일부 봉인 조건 셀 때문에 coverage/unambiguity/invariant_generality는 5점이 아닌 4점대로 제한했다.",
  "evaluated_at": "2026-07-24T00:21:24+09:00",
  "model": "gpt-5.5",
  "metadata": {
    "prompt_version": "eval_system:v1",
    "source_files": [
      "d1309fc2_input.json",
      "d1309fc2_iter-002_draft.json"
    ],
    "token_usage": {
      "input_tokens": 37204,
      "cached_input_tokens": 1408,
      "cache_write_input_tokens": 0,
      "output_tokens": 1266,
      "reasoning_output_tokens": 516
    }
  }
}
