{
  "brief_hash": "9885d9d1",
  "iteration": "002",
  "rubric_name": "contract:v1-spec",
  "rubric_scores": {
    "scores": {
      "coverage": 4,
      "boundary_fidelity": 4,
      "unambiguity": 4,
      "behavioral_altitude": 3
    },
    "weights": {
      "coverage": 0.3,
      "boundary_fidelity": 0.3,
      "unambiguity": 0.2,
      "behavioral_altitude": 0.2
    },
    "weighted_total": 3.9
  },
  "axis_rationales": {
    "coverage": "열거 7개, 누락 0개: [상방 네 조건 충족 시 발화와 결과 산출, 하방 네 조건 충족 시 발화와 결과 산출, 상방 조건별 거절, 하방 조건별 거절, 리스크 0 거절, 동시발화 불가, 닫히지 않은 캔들 제외]; 핵심 경계는 대부분 덮지만 동시발화 불가와 방향 독립성은 한쪽 예시 중심이라 5점까지는 어렵다.",
    "boundary_fidelity": "모든 When은 '닫힌 캔들열로 볼린저밴드 레그 트리거 발화를 평가'라는 단일 유스케이스에 대응하고 Then은 발화 개수·방향·진입가·손절가·목표가·시한 같은 관찰 결과이나, Given에 상단선·하단선·밴드폭·백분위 값 등 중간 산출값을 직접 주입해 경계 입력과 rules 입력의 구분이 일부 흐려진다.",
    "unambiguity": "Then은 모두 구체값 또는 명확한 부재 단언이라 틀린 구현을 실패시킬 수 있고 봉인된 단언은 없지만, '발화 결과는 없다'가 어떤 방향별 결과 집합인지 세부가 덜 드러나는 곳이 있어 5점은 아니다.",
    "behavioral_altitude": "대체로 도메인 언어로 작성됐고 구현 시그니처는 노출하지 않지만, feature 본문에 목표 배수·밴드폭 비교·상단선/하단선 수치·목표가 산출값 검산을 반복적으로 박아 rules 문서에 가까운 산술 세부가 여러 곳 섞여 있어 캡상 3점이다."
  },
  "calibration_note": "엄격 게이트 기준으로 평균 3.0을 기준점으로 보정했다. contract 모드 coverage에서는 내부 산술 규칙 자체는 누락으로 세지 않았고, 산식 노출은 behavioral_altitude에서 감점했다.",
  "evaluated_at": "2026-07-24T00:04:46+09:00",
  "model": "gpt-5.5",
  "metadata": {
    "prompt_version": "eval_system:v1",
    "source_files": [
      "9885d9d1_input.json",
      "9885d9d1_iter-002_draft.json"
    ],
    "token_usage": {
      "input_tokens": 31001,
      "cached_input_tokens": 1408,
      "cache_write_input_tokens": 0,
      "output_tokens": 1078,
      "reasoning_output_tokens": 516
    }
  }
}
