{
  "brief_hash": "9fa3f192",
  "iteration": "002",
  "rubric_name": "writing:v1",
  "rubric_scores": {
    "scores": {
      "structure": 4.3,
      "evidence": 4,
      "sentence": 4.2,
      "originality": 3.8,
      "purpose_fit": 4.5
    },
    "weights": {
      "structure": 0.25,
      "evidence": 0.25,
      "sentence": 0.2,
      "originality": 0.15,
      "purpose_fit": 0.15
    },
    "weighted_total": 4.16
  },
  "axis_rationales": {
    "structure": "README의 핵심 요소에서 사용 경험, 장단점, 보완점, 다음 실험으로 흐름이 자연스럽게 이어지며 결론도 통제감이라는 핵심으로 잘 회수된다.",
    "evidence": "역할 분리, 파일 핸드오프, 정보 차단, 검증 게이트, 실패 정책 등 README 기반 근거가 충분하지만 실제 사용 장면의 세부 감각은 일부 추상적으로 남아 있다.",
    "sentence": "문장 흐름이 안정적이고 논리 연결이 매끄러우며 군더더기가 적지만 몇몇 문단은 설명 밀도가 높아 리듬이 다소 균질하다.",
    "originality": "하네스를 자동화 도구보다 관찰과 통제의 장치로 보는 관점이 선명하지만 표현과 발견의 일부는 개발 도구 회고에서 익숙한 범위에 머문다.",
    "purpose_fit": "AI native 개발 방식과 글쓰기 자동화에 관심 있는 개발자를 정확히 겨냥하고, 요청된 장점·단점·보완사항·다음 실험을 빠짐없이 반영한다."
  },
  "calibration_note": "평균 3.0 기준으로 보정했을 때 전반적 완성도와 목적 부합도는 높지만, 5점 수준의 강한 현장감이나 독창적 언어까지는 제한적이라고 판단했다.",
  "evaluated_at": "2026-06-16T22:28:49+09:00",
  "model": "gpt-5.5",
  "metadata": {
    "prompt_version": "eval_system:v1",
    "source_files": [
      "9fa3f192_input.json",
      "9fa3f192_iter-002_draft.json"
    ],
    "token_usage": {
      "input_tokens": 17679,
      "cached_input_tokens": 2432,
      "output_tokens": 687,
      "reasoning_output_tokens": 270
    }
  }
}
