{
  "brief_hash": "9885d9d1",
  "iteration": "001",
  "rubric_name": "contract:v1-spec",
  "rubric_scores": {
    "scores": {
      "coverage": 4,
      "boundary_fidelity": 5,
      "unambiguity": 3,
      "behavioral_altitude": 4
    },
    "weights": {
      "coverage": 0.3,
      "boundary_fidelity": 0.3,
      "unambiguity": 0.2,
      "behavioral_altitude": 0.2
    },
    "weighted_total": 4.1
  },
  "axis_rationales": {
    "coverage": "열거 9개, 누락 0개: [상방 네 조건 모두 참 발화, 하방 네 조건 모두 참 발화, 상방 조건별 거절, 하방 조건별 거절, 상방 리스크 0 미발화, 하방 리스크 0 미발화, 발화 결과의 진입가·손절가·목표가·시한, 방향별 독립, 미닫힌 캔들 제외]; 다만 주요 조건 경계가 일부 단일점 위주라 5점은 아님.",
    "boundary_fidelity": "모든 When은 '닫힌 캔들열로 볼린저밴드 레그 트리거 발화 평가'라는 inbound port 1개에 대응하고, Then은 발화 개수·방향·가격·시한 같은 경계 관찰 결과만 단언하며 호출 순서·횟수·내부상태 단언은 없다.",
    "unambiguity": "대부분 구체값 단언이나 상방/하방 리스크 0 시나리오의 OHLC가 각각 저가>시가, 고가<시가로 캔들 값 자체가 비일관적이고, '하위 25%에 포함된다'는 백분위 경계 입력은 산출 근거 없이 봉인되어 느슨함이 남는다.",
    "behavioral_altitude": "구현 클래스·메서드·enum은 노출하지 않고 도메인어 중심이나, 상단선·하단선·밴드폭 백분위와 목표 배수 숫자 계산값이 feature에 반복되어 rules 문서로 분리될 산식 성격의 기술적 표현이 일부 섞여 있다."
  },
  "calibration_note": "엄격 게이트 기준으로 평균 3.0을 기준점으로 두고, 누락은 없지만 경계 삼각측량과 fixture 일관성 문제가 있어 총점은 임계값 아래로 산정했다.",
  "evaluated_at": "2026-07-24T00:01:20+09:00",
  "model": "gpt-5.5",
  "metadata": {
    "prompt_version": "eval_system:v1",
    "source_files": [
      "9885d9d1_input.json",
      "9885d9d1_iter-001_draft.json"
    ],
    "token_usage": {
      "input_tokens": 30319,
      "cached_input_tokens": 1408,
      "cache_write_input_tokens": 0,
      "output_tokens": 1045,
      "reasoning_output_tokens": 516
    }
  }
}
